{
  "symbol": "FPT",
  "as_of_date": "2026-07-30",
  "price_summary": {
    "last_close": 67.0,
    "prev_close": 67.83,
    "change_abs": -0.83,
    "change_pct": -0.0122,
    "last_volume": 7571500,
    "note": "OPEN ITEM shape; see contracts/OPEN_ITEMS.md"
  },
  "indicators": {
    "note": "OPEN ITEM shape; see contracts/OPEN_ITEMS.md",
    "sma_20": 71.19
  },
  "money_flow": {
    "accumulation_distribution_line": 1423.77,
    "on_balance_volume": 63375267.0,
    "up_down_volume_ratio": 0.75,
    "volume_at_price_concentration": {
      "note": "OPEN ITEM shape; see contracts/OPEN_ITEMS.md",
      "buckets": []
    },
    "unusual_volume_flags": [],
    "close_vs_vwap": null
  },
  "strategy_results": [
    {
      "symbol": "FPT",
      "as_of_date": "2026-07-30",
      "strategy_id": "minervini_trend_template",
      "strategy_version": "1.0.0",
      "signal": "watch",
      "score": 6,
      "max_score": 8,
      "passed_criteria": [
        "close_above_150d_sma",
        "close_above_200d_sma",
        "150d_sma_above_200d_sma"
      ],
      "failed_criteria": [
        "within_25pct_of_52w_high"
      ],
      "levels": {
        "support": [
          64.0,
          61.5
        ],
        "resistance": [
          68.5,
          71.0
        ],
        "invalidation": 60.0
      },
      "data_version": "fdata-2026-07-30",
      "warnings": []
    }
  ],
  "financial_summary": {
    "note": "OPEN ITEM shape; see contracts/OPEN_ITEMS.md",
    "latest_revenue": 21672.89,
    "latest_net_income": 1927.3
  },
  "levels": {
    "support": [
      64.0,
      61.5
    ],
    "resistance": [
      68.5,
      71.0
    ],
    "invalidation": 60.0
  },
  "data_quality": {
    "freshness_status": "current",
    "warnings": [
      "SYNTHETIC FIXTURE DATA. Generated by contracts/fixtures/generate_fixtures.py for contract development only; not sourced from any real feed. Only the final bar (2026-07-30), where present, matches the verified example in Section 10.1 of vn_terminal_multi_ai_development_plan.md v1.1."
    ]
  },
  "sources": [
    "https://vnstock.example/placeholder"
  ],
  "calculation_definitions": [
    "sma_20: simple moving average of close over the trailing 20 trading days."
  ]
}
